{
  "batch_id": "05",
  "version": "1.0.0",
  "generated_date": "2026-03-24",
  "generated_by": "gemini",
  "question_count": 25,
  "difficulty_distribution": {
    "easy": 5,
    "medium": 14,
    "hard": 6
  },
  "questions": [
    {
      "question_id": "B05-Q001",
      "rule_ids": [
        "RC-MED-002"
      ],
      "domain": "Texas State Statutes Pertaining to Life, Health, and HMOs",
      "subdomain": "Medicare Supplement Texas Rules",
      "difficulty": "hard",
      "format": "calculation_scenario",
      "stem": "A 65-year-old Texas resident enrolls in a Medicare Supplement (Medigap) policy. She had 3 months of continuous creditable group health coverage immediately prior to enrolling. What is the maximum pre-existing condition waiting period the insurer can legally apply to her new Medigap policy?",
      "options": [
        {
          "label": "A",
          "text": "0 months"
        },
        {
          "label": "B",
          "text": "3 months"
        },
        {
          "label": "C",
          "text": "6 months"
        },
        {
          "label": "D",
          "text": "9 months"
        }
      ],
      "correct_answer": "B",
      "correct_explanation": "Insurers may generally impose a maximum pre-existing condition waiting period of 6 months on a new Medigap policy. However, federal and state laws require this 6-month period to be reduced month-for-month by the applicant's prior continuous creditable coverage. Since the applicant had 3 months of creditable coverage, the maximum waiting period is reduced to 3 months (6 months max minus 3 months creditable = 3 months).",
      "wrong_explanations": {
        "A": "A zero-month waiting period only applies if the applicant had 6 or more months of continuous creditable coverage.",
        "C": "6 months is the standard maximum waiting period for an individual with no prior creditable coverage. It must be reduced by her prior coverage.",
        "D": "9 months exceeds the maximum allowable pre-existing condition waiting period for Medicare Supplements."
      },
      "trap_type": "TP006-Math_Distractor",
      "source_confidence": "high",
      "review_status": "validated",
      "status_history": [
        {
          "status": "draft",
          "timestamp": "2026-03-24T15:34:00Z",
          "actor": "gemini"
        },
        {
          "status": "validated",
          "timestamp": "2026-03-24T16:30:00Z",
          "actor": "ChatGPT"
        }
      ]
    },
    {
      "question_id": "B05-Q002",
      "rule_ids": [
        "RC-HLTH-008"
      ],
      "domain": "Policy Riders, Provisions, Options, and Exclusions",
      "subdomain": "Standard Health Provisions",
      "difficulty": "medium",
      "format": "concept_application",
      "stem": "Under the mandatory provisions of the Uniform Individual Accident and Sickness Policy Provisions Law, how many days does the insured typically have to submit a formal written 'Proof of Loss' to the insurer after a covered loss occurs?",
      "options": [
        {
          "label": "A",
          "text": "15 days"
        },
        {
          "label": "B",
          "text": "20 days"
        },
        {
          "label": "C",
          "text": "60 days"
        },
        {
          "label": "D",
          "text": "90 days"
        }
      ],
      "correct_answer": "D",
      "correct_explanation": "The standard Proof of Loss provision requires the insured to submit formal written proof to the insurer within 90 days of the loss, or as soon as reasonably possible (but not to exceed one year unless the insured is legally incapacitated).",
      "wrong_explanations": {
        "A": "15 days is the timeframe the insurer has to provide claim forms to the insured after receiving a Notice of Claim.",
        "B": "20 days is the timeframe the insured has to provide the initial 'Notice of Claim' to the insurer, not the final Proof of Loss.",
        "C": "60 days is the waiting period an insured must observe after filing Proof of Loss before they can initiate a lawsuit against the insurer."
      },
      "trap_type": "TP003-Confusion_Pair",
      "source_confidence": "high",
      "review_status": "validated",
      "status_history": [
        {
          "status": "draft",
          "timestamp": "2026-03-24T15:34:00Z",
          "actor": "gemini"
        },
        {
          "status": "validated",
          "timestamp": "2026-03-24T16:30:00Z",
          "actor": "ChatGPT"
        }
      ]
    },
    {
      "question_id": "B05-Q003",
      "rule_ids": [
        "RC-UW-003"
      ],
      "domain": "Completing the Application, Underwriting, and Delivering the Policy",
      "subdomain": "Receipts (Conditional vs. Binding)",
      "difficulty": "hard",
      "format": "scenario",
      "stem": "An applicant completes a life insurance application, pays the initial premium, and is given a conditional receipt. The insurer requires a medical exam as part of the underwriting process. The very next day, before taking the required medical exam, the applicant dies in a car accident. How will the insurer handle the claim?",
      "options": [
        {
          "label": "A",
          "text": "Pay the full death benefit, because the premium was paid and the receipt was issued."
        },
        {
          "label": "B",
          "text": "Pay the death benefit, but deduct the cost of the missed medical exam from the proceeds."
        },
        {
          "label": "C",
          "text": "Deny the claim and refund the premium, because the required medical exam was not completed."
        },
        {
          "label": "D",
          "text": "Deny the claim, because conditional receipts never cover accidental death prior to policy delivery."
        }
      ],
      "correct_answer": "C",
      "correct_explanation": "A conditional receipt makes coverage effective as of the date of the application OR the date of the required medical exam, whichever is later\u2014provided the applicant is insurable at standard rates. Because the applicant died before taking the required medical exam, the condition for coverage was never met. The insurer will deny the claim and refund the premium.",
      "wrong_explanations": {
        "A": "Paying the premium is only one condition; completing required medical exams is the other. Coverage does not begin until all requirements are met.",
        "B": "Insurers do not pay claims with deductions for missed underwriting requirements. If the requirements aren't met, there is no coverage.",
        "D": "Conditional receipts do cover accidental death, provided the applicant has met all conditions (including the medical exam) and is deemed insurable."
      },
      "trap_type": "TP004-Timeline_Trap",
      "source_confidence": "high",
      "review_status": "validated",
      "status_history": [
        {
          "status": "draft",
          "timestamp": "2026-03-24T15:34:00Z",
          "actor": "gemini"
        },
        {
          "status": "validated",
          "timestamp": "2026-03-24T16:30:00Z",
          "actor": "ChatGPT"
        }
      ]
    },
    {
      "question_id": "B05-Q004",
      "rule_ids": [
        "RC-BUS-001",
        "RC-UW-001"
      ],
      "domain": "Completing the Application, Underwriting, and Delivering the Policy",
      "subdomain": "Application Procedures",
      "difficulty": "easy",
      "format": "concept_application",
      "stem": "A corporation purchases a Key Person life insurance policy on its top executive. The corporation is the applicant, policyowner, premium payor, and beneficiary. Who must sign the application to give consent for this policy to be issued?",
      "options": [
        {
          "label": "A",
          "text": "Only an authorized officer of the corporation"
        },
        {
          "label": "B",
          "text": "Only the Key Person (the executive)"
        },
        {
          "label": "C",
          "text": "Both an authorized officer of the corporation and the Key Person"
        },
        {
          "label": "D",
          "text": "The corporation's board of directors and the agent"
        }
      ],
      "correct_answer": "C",
      "correct_explanation": "In any life insurance transaction involving third-party ownership, both the applicant/owner (an authorized officer of the corporation) and the proposed insured (the Key Person) must sign the application. The insured must sign to provide written consent to be insured.",
      "wrong_explanations": {
        "A": "The corporation cannot legally take out a life insurance policy on an employee without the employee's written consent and signature.",
        "B": "The executive must sign as the insured, but the corporation must also sign as the applicant and owner of the policy.",
        "D": "While the agent signs the application, the critical missing signature in this option is the proposed insured's consent."
      },
      "trap_type": null,
      "source_confidence": "high",
      "review_status": "validated",
      "status_history": [
        {
          "status": "draft",
          "timestamp": "2026-03-24T15:34:00Z",
          "actor": "gemini"
        },
        {
          "status": "validated",
          "timestamp": "2026-03-24T16:30:00Z",
          "actor": "ChatGPT"
        }
      ]
    },
    {
      "question_id": "B05-Q005",
      "rule_ids": [
        "RC-TAX-001"
      ],
      "domain": "Taxes, Retirement, and Other Insurance Concepts",
      "subdomain": "Taxation of Health Insurance",
      "difficulty": "medium",
      "format": "concept_application",
      "stem": "A self-employed architect purchases an individual Disability Income policy and pays the premiums out of her personal, after-tax savings. How are the premiums and benefits treated for federal income tax purposes?",
      "options": [
        {
          "label": "A",